{
  "command": [
    "./TOOLS/mumax3-bin",
    "-o",
    "/tmp/claude-1000/-home-rodrigo-pesquisa-SAF/471574db-345c-43d2-a045-35b73207a394/scratchpad/a008/a0.25_r2.out",
    "-f",
    "LAB/EVIDENCE/A008/mesh_a0.25nm_r2.mx3"
  ],
  "cwd": "/home/rodrigo/pesquisa/SAF",
  "determinism": {
    "declared": "UNDECLARED",
    "seed": "UNSPECIFIED"
  },
  "duration_seconds": 0.164252153,
  "environment": {
    "executable": {
      "bytes": 14514312,
      "path": "TOOLS/mumax3-bin",
      "sha256": "43cfcbc0beda1ea153ee80d536b38c42e1f817885b2ea85aac9277be2a479acb",
      "status": "PRESENT"
    },
    "machine": "x86_64",
    "os": "Linux-6.1.0-52-amd64-x86_64-with-glibc2.36",
    "python": "3.11.2"
  },
  "executor": {
    "agent": "Claude (Claude Code)",
    "human_checkpoint": "WRITEBACK-039"
  },
  "exit_code": 0,
  "finished_at": "2026-08-28T15:30:38.669971Z",
  "inputs": [
    {
      "bytes": 607,
      "path": "/home/rodrigo/pesquisa/SAF/LAB/EVIDENCE/A008/mesh_a0.25nm_r2.mx3",
      "sha256": "082d97b93b5da3a8baab8f5d25fdb9d9f4f2165c731bf13de27ae2f262d4ff62",
      "status": "PRESENT"
    }
  ],
  "mission_id": "MISSION-A008",
  "outputs": [
    {
      "path": "/home/rodrigo/pesquisa/SAF/LAB/EVIDENCE/A008/ck_a0.25nm_r2.ovf",
      "status": "MISSING"
    }
  ],
  "parameters": {
    "MinimizerStop": 1e-08,
    "a_nm": 0.25,
    "rodada": 2
  },
  "run_id": "a0.25nm-r2",
  "schema_version": 1,
  "started_at": "2026-08-28T15:30:38.491650Z",
  "state": "COMPLETE",
  "timeout_seconds": 5400.0
}
